nama_tempat,rating_tempat,user_ratings_total,latitude,longitude,alamat_tempat,place_id,distance
warteg nojo jaya,4.5,111,-6.215811599999999,106.8220707,"jl. bek murad no 18 rt 08/rw 01 kel, rt.8/rw.3, kuningan, karet kuningan, kota jakarta selatan",ChIJX1fv6wD0aS4RyuRA7AzPMdU,0.0055301000000058664
warteg putra bahari,5,1,-6.2227801,106.8323515,"jl. menteng atas barat, rt.16/rw.4, kuningan, karet kuningan, kota jakarta selatan",ChIJVVi88qfzaS4Rkk8n8QeYzMk,0.016496199999997074
warteg nojo jaya,3.5,8,-6.2105606,106.8235463,"jalan raya kelurahan setiabudi no.2, rt.2/rw.2, kuningan, setia budi, kota jakarta selatan",ChIJv9lqjAP0aS4RF_M7KtfPA6Y,0.004528500000000157
warteg putri,4.5,105,-6.223198,106.828236,"jalan asem 4, rt.14/rw.4, kuningan, karet kuningan, kota jakarta selatan",ChIJ6xUMFvrzaS4RaCeYKqPzOHY,0.012798599999999993
warteg ibu nur,5,1,-6.2217946,106.8302986,"no., jl. pedurenan mesjid 1 no.22, rt.16/rw.4, kuningan, karet kuningan, kota jakarta selatan",ChIJW8HBUffzaS4Rwmp3Vi3ULJo,0.013457800000002074
warteg dj,4.6,18,-6.22937,106.821576,"jl. guru mughni no.9, rt.2/rw.5, kuningan, kuningan tim., kota jakarta selatan",ChIJ-zMdEOPzaS4RsP1D_W1cffk,0.019583200000011125
warteg kembang,4.1,148,-6.2269406,106.8218963,"jl. guru mughni jl. sd no.21, rt.5/rw.1, kuningan, kuningan tim., kota jakarta selatan",ChIJfeXGxPzzaS4Ra8mJIOI6C5w,0.016833499999997947
warteg ibu wati,4.4,59,-6.2147302,106.8275275,"jl. karbela timur no.9, rt.9/rw.4, kuningan, karet, kota jakarta selatan",ChIJsWe4sgf0aS4RceYsAUFVx4E,0.003622299999998191
warteg mekarjaya,4.4,53,-6.221789999999999,106.825715,"jl. pedurenan masjid iii no.4, rt.3/rw.6, kuningan, kota jakarta selatan",ChIJ0ZdzeYjzaS4RgKW6JmNNDHQ,0.008869599999997035
warteg bahari,4,1,-6.2208801,106.8200318,"jl. karet sawah, rt.3/rw.3, karet semanggi, kota jakarta selatan",ChIJd2e5RP7zaS4RMoTbprhaktI,0.012637500000008295
warteg bu ati,0,0,-6.229400399999999,106.8215767,"jl. guru mughni no.10, rt.2/rw.5, kuningan, kuningan tim., kota jakarta selatan",ChIJezhuEOPzaS4R_31zYm2fBZg,0.019612900000009148
warteg net bahari,4.4,53,-6.227582600000001,106.8215623,"jl. guru mughni, rt.2/rw.5, rt.4/rw.1, kuningan, kuningan tim., kota jakarta selatan",ChIJRcEfaj7zaS4RO2XyTjNbAUs,0.01780950000000825
warteg baru,5,2,-6.2111319,106.8400303,"jl. menteng bata, rt.15/rw.7, ps. manggis, kota jakarta selatan",ChIJmWORogz0aS4R5_U6TpLzv8E,0.017109199999991276
warteg mekar jaya,5,2,-6.214582999999999,106.8256022,"jl. karet belakang barat, rt.12/rw.2, kuningan, karet, kota jakarta selatan",ChIJM_Mh4gb0aS4RCIhNxG1QLKk,0.0015498000000011558
warteg barokah,4.6,5,-6.216711999999999,106.827459,"jl. karet belakang barat no.3 no 20, rt.19/rw.2, kuningan, karet kuningan, kota jakarta selatan",ChIJf7Ge7R71aS4RXUK_OuZXQK4,0.005535599999999974
warteg rizky,3.8,9,-6.229686,106.8225727,"jalan perintis rt.2/rw.5, rt.3/rw.5, kuningan, kuningan tim., kota jakarta selatan",ChIJq15KFOPzaS4RRIvf0vROEU4,0.018902500000009148
warteg bahari,4.5,6,-6.209216199999999,106.826903,"jalan setia budi tengah no. 07, rt.1/rw.1, setia budi, kecamatan setiabudi, rt.1/rw.1, kuningan, setia budi, kota jakarta selatan",ChIJC00EUCH1aS4RoMLt2gsdy2k,0.005897599999998171
warteg putri,4.5,17,-6.219725299999999,106.8244858,"jl. h. sidik no.30, rt.6/rw.6, kuningan, karet kuningan, kota jakarta selatan",ChIJObivLHDzaS4Rrutp4VQq0M8,0.007028699999997556
warteg nojo jaya,5,4,-6.213248999999999,106.8289988,"jl. karet karya no.5, rt.5/rw.5, kuningan, karet, kota jakarta selatan",ChIJBz7kIx31aS4RSK9HTU3m3bI,0.003960599999990322
warteg barokah,0,0,-6.2190124,106.8379213,"jl. menteng atas sel. gg. 2 no.5, rt.4/rw.5, menteng atas, kota jakarta selatan",ChIJY0fmC531aS4RSyHk65ODHDU,0.018298300000001433
wahyoo warteg putra bahari,0,0,-6.219144900000001,106.8379734,"4, rt.5/rw.5, menteng atas, kota jakarta selatan",ChIJZ6pdjzTzaS4R1g3rBCgJ11k,0.01848289999999242
warteg berkah,5,1,-6.221354,106.842741,"jl. menteng pulo no.4, rt.5/rw.9, menteng atas, kota jakarta selatan",ChIJJS43VVTzaS4RMhUCYQDXpcE,0.025459599999999583
warteg bu ani,3.8,4,-6.218558199999999,106.8226617,"gg. tiong ujung kecamatan no.20.rt 04/01, rt.7/rw.4, kuningan, karet kuningan, kota jakarta selatan",ChIJPcROR__zaS4R44eusKgsCck,0.0076857000000050135
warteg biru,4.4,19,-6.222900999999999,106.8209295,"jl. guru mughni blok no.8, rt.1/rw.3, karet semanggi, kota jakarta selatan",ChIJN66F9_zzaS4RSmv_R9fk6Cw,0.01376069999999796
warteg akotizam,4.6,44,-6.2126686,106.8234422,"jl. karet gusuran iii gg. kamboja no.10, rt.6/rw.1, kuningan, karet, kota jakarta selatan",ChIJZZDGUwH0aS4R_Jn8cbpksvQ,0.0025246000000018753
warteg 88,4.1,17,-6.212848699999999,106.825929,"jalan perintis rt 8 rw 5, kelurahan karet, kecamatan setia budi, rt.12/rw.4, kuningan, karet, kota jakarta selatan",ChIJj2o9kAb0aS4RvV3NSi8oMRQ,0.0012910999999995454
warteg barokah,4.8,12,-6.219698999999999,106.838137,"jl. menteng atas barat, rt.5/rw.5, menteng atas, dki jakarta",ChIJm5kBVPTzaS4RRZCxr82lqFA,0.01920059999999868
warteg 100%,4.4,42,-6.216796599999999,106.8222188,"jalan bek kh rohyani i no. 9, rt.6/rw.1, karet kuningan, kecamatan setiabudi, rt.6/rw.1, kuningan, karet kuningan, kota jakarta selatan",ChIJuZARmAD0aS4R7dIOEU0CIg4,0.0063670000000009
warteg alto,4,1,-6.206910799999999,106.8306127,"jl. kuningan mulia no.2, rt.1/rw.6, guntur, kota jakarta selatan",ChIJnaHRkA_0aS4R3Aj8ZE-fsNg,0.011912699999999887
warteg citaayu,0,0,-6.2171727,106.8404217,"jl. menteng atas dalam, rt.14/rw.6, menteng atas, kota jakarta selatan",ChIJ4Y-VW_XzaS4R66zBHx0QdTM,0.018958999999989068
warteg bahari pasar rumput,0,0,-6.2076568,106.8418593,"jl. sultan agung no.25, rt.5/rw.2, ps. manggis, kota jakarta selatan",ChIJX3UKt3z1aS4RgFZ2UMEJFGA,0.022413299999992198
warteg murni,4.5,2,-6.208837399999999,106.8421317,"jl. menteng wadas timur, rt.9/rw.2, ps. manggis, kota jakarta selatan",ChIJCf792XL0aS4RZMOSt7Da3DI,0.021505099999992616
warteg gaspoll 2.0,4.5,4,-6.2225658,106.8212412,"jl. prof. dr. satrio no.8, rt.17/rw.6, kuningan, karet kuningan, kota jakarta selatan",ChIJne7qKfzzaS4RpnpEbCwVUYA,0.013113800000001063
warteg takyat,4.3,108,-6.2063726,106.838335,"jl. guntur no.2, rt.8/rw.1, guntur, kota jakarta selatan",ChIJaUyE_iL1aS4RoZV9tGTz6cA,0.020173199999996783
warteg ahai jaya,4.7,43,-6.217871,106.82706,"jl anggrek 5 rt 14/rw 07 kel, 7 no.16, rt.16/rw.7, kuningan, karet kuningan, kota jakarta selatan",ChIJpRu8ZPjzaS4RZOc8Q7r-8KU,0.0062955999999987355
warteg berkah,4.3,3,-6.222456999999999,106.820594,"jl. guru mughni no.147, rt.1/rw.3, karet semanggi, kota jakarta selatan",ChIJmRFo5qrzaS4RJLZsBv2W5Vg,0.013652200000002779
warteg hikmah,5,8,-6.212356,106.837945,"jl menteng wadas selatan no6 rt03/rw12 kel, rt.11, ps. manggis, kota jakarta selatan",ChIJjWe76bT1aS4RDWNLnj-IqoE,0.013799800000001028
warteg mekar jaya,4.4,18,-6.2217954,106.8257664,"jl. karet pedurenan no.52 4, rt.4/rw.7, kuningan, karet kuningan, kota jakarta selatan",ChIJ3-tla_nzaS4R7BfOt7mwEEY,0.008926400000002666
warteg dua saudara,4.5,13,-6.221017,106.827992,"jl pedurenan masjid raya rt 06/rw 07 kel, rt.6/rw.7, kuningan, karet kuningan, kota jakarta selatan",ChIJK2uIlfnzaS4R2w2xmEMl-Sk,0.010373599999990546
warteg badriah,0,0,-6.2097962,106.8272084,"jl. taman setia budi ii no.50, rt.1/rw.2, kuningan, setia budi, kota jakarta selatan",ChIJ0REFe7z1aS4RTCGRGEuLvjE,0.005622999999999045
warteg della,4.3,3,-6.2298787,106.8214684,"jl. peltu rahmat sidup, rt.2/rw.2, karet semanggi, kota jakarta selatan",ChIJi1MQBuPzaS4RIoo3vQ60NW4,0.020199500000003923
warteg emak,4.6,11,-6.222114899999999,106.8409979,"jl. menteng pulo ii no.8, rt.16/rw.12, menteng dalam, kota jakarta selatan",ChIJddVfNPPzaS4RKVPQVOTT8gs,0.024477400000000316
warteg rakyat,4.3,16,-6.2168126,106.8224824,"jalan k jl. kh royani iii no.10, rt.6/rw.1, kuningan, karet kuningan, kota jakarta selatan",ChIJ138lowD0aS4RX6Odqe9XqQ0,0.006119400000005548
warteg anugrah,5,1,-6.205197,106.833145,"jl. galunggung no.05, rt.12/rw.6, guntur, kota jakarta selatan",ChIJu3cTefr1aS4RAPVqMJzbBM0,0.016158799999997697
warteg sari asih,0,0,-6.209889,106.822346,"jalan barat kelurahan setiabudi kecamatan setiabudi, setiabudi, rt.2/rw.2, kuningan, setia budi, dki jakarta",ChIJtwDAYgT0aS4RZvoZczGj0OY,0.006400400000007522
warteg siang malam,4.6,51,-6.2147085,106.8436209,"jl. minangkabau barat no.75, rt.7/rw.8, ps. manggis, kota jakarta selatan",ChIJPzcUHHX0aS4RoVB7xpFPE0Y,0.01969400000000121
warteg samiaji,4.1,21,-6.2052166,106.8329692,"jl. sultan agung no.6, rt.12/rw.6, guntur, kota jakarta selatan",ChIJh3qpthH0aS4RZsoSy5w2T4k,0.015963399999989747
warteg karunia rahayu,4.2,18,-6.219502400000001,106.8427692,"jl. subur dalam no.8, rt.4/rw.8, menteng atas, kota jakarta selatan",ChIJfWmaIYvzaS4RURpv4xrH_Nw,0.023636200000003882
warteg pandan wangi,2.5,2,-6.219761,106.826687,"jl. peduranan masjid 2 kelurahan karet kuningan kecamatan setiabudi, dki jakarta",ChIJFwAAAPnzaS4Rf6j2RPhx2BI,0.007812600000002945
