nama_tempat,rating_tempat,user_ratings_total,latitude,longitude,alamat_tempat,place_id,distance
warteg bahari,4.3,438,-6.2516782,106.8505178,"jl. pengadegan selatan no.12, rt.3/rw.5, pengadegan, kota jakarta selatan",ChIJIV4Ig7HzaS4RAOHhKF4zxeE,0.01096489999999406
warteg jaya,3.9,28,-6.2712922,106.8379339,"jl. siaga raya no.40, rt.16/rw.4, pejaten bar., kota jakarta selatan",ChIJba7_GjnyaS4RwvL_2vfaeuE,0.029624000000005424
warteg 24 jam,4.3,44,-6.2463126,106.8590844,"jl. cikoko timur raya no.10, rt.4/rw.1, cikoko, kota jakarta selatan",ChIJXxB3_aXzaS4ROq1fqmtY66I,0.01650609999999908
warteg bu haji,0,0,-6.2533106,106.8481756,"jl. kh.mahmud,buntu no.7, rt.5/rw.4, duren tiga, kota jakarta selatan",ChIJs0Hks73zaS4R7qyhiRJX9jk,0.011674699999995042
warteg wareg,4.2,11,-6.2604745,106.8548314,"jl. rawajati timur ii, rt.8/rw.2, rawajati, kota jakarta selatan",ChIJi23uQlLyaS4RE38gTLQ5ePI,0.0021449999999951785
warteg rewangi,4.6,31,-6.2590946,106.8595283,"gg porti rt 10, gg. porti no.34, rt.10/rw.1, rawajati, kota jakarta selatan",ChIJaXaL63TzaS4RD1aRlunHBRo,0.005461999999994305
warteg latifah,4.3,21,-6.266245,106.8422818,"jalan warung jati timur, rt.10, pejaten bar., kota jakarta selatan",ChIJF3u8PEjyaS4RppTLQD3jtGY,0.020228900000005545
warteg restu ibu,4.2,22,-6.2472631,106.8534447,"jl. pengadegan utara ii no.4 rt.007/rw.07 kel, rt.8/rw.6, pengadegan, kota jakarta selatan",ChIJZdF7WOjzaS4RxgYkFhzAzTE,0.01245310000000277
warteg salsabila ( warung makan )🏣,4.4,8,-6.2722508,106.8464372,"gg. bend. no.39, rt.1/rw.3, pejaten bar., kota jakarta selatan",ChIJ24VZsEbyaS4Rq1YUWGLo7VE,0.02207930000000413
warteg rejo,4.3,85,-6.2500474,106.8365005,"jl. pancoran barat vii, rt.3/rw.6, pancoran, kota jakarta selatan",ChIJwzmO2MjzaS4RhQ3lUJ_iSZo,0.02661300000000022
warteg aji,3.9,14,-6.2590796,106.8436271,"jl. kalibata timur i gg. rukun no.2, rt.1/rw.8, kalibata, kota jakarta selatan",ChIJJ6716EryaS4RanjpCv2gLg8,0.01171819999999446
warteg bahariin,0,0,-6.2419072,106.8370313,"jl. pancoran barat xi, rt.1/rw.3, pancoran, kota jakarta selatan",ChIJmwIiSLTzaS4RCHygGEbhyUg,0.03422239999999288
warteg,0,0,-6.251912799999999,106.8494694,"jl. h. mahmud raya, rt.4/rw.4, kalibata, kota jakarta selatan",ChIJp2isKTbzaS4RZPwI0GYl890,0.011778699999997144
warteg dewi,3.8,4,-6.2534892,106.840767,"jl. duren tiga raya, rt.1/rw.1, pancoran, kota jakarta selatan",ChIJ624TDsrzaS4RtcJpUsWQ24E,0.01890470000000022
warteg zakaria,0,0,-6.258705600000001,106.8377832,"jl. duren tiga selatan no.67, rt.8/rw.3, duren tiga, kota jakarta selatan",ChIJEdU31onzaS4R3-9pMWJZO68,0.017188099999997597
warteg rizki,4.1,65,-6.2660974,106.8373555,"jl. h. samali no.85a, rt.19/rw.1, pejaten bar., kota jakarta selatan",ChIJfSI6FzfyaS4RV5A5eTBt33M,0.025007599999999464
warteg baru,4.7,6,-6.270289000000001,106.844388,"jalan warung buncit raya no 7 (dekat halte busway jatipadang), rt.6/rw.1, pejaten bar., kota jakarta selatan",ChIJif___0byaS4RQFXVn523rY4,0.022166700000006756
warteg berkah,4.6,15,-6.260322299999999,106.8433643,"jl. raya pasar minggu no.4, rt.5/rw.8, kalibata, kota jakarta selatan",ChIJHzBDQ0ryaS4RnbkZLtNcKPg,0.013223699999994842
warteg ibu wiwi,4.6,81,-6.2724758,106.8409511,"jl. warga i ma no.69, rt.14/rw.3, pejaten bar., kota jakarta selatan",ChIJ3dzsrjjyaS4R8q0L6svz864,0.027790400000002435
warteg wahyu,4.3,3,-6.268618999999999,106.8460563,"jl. raya pasar minggu no.8c, rt.12/rw.1, pejaten tim., kota jakarta selatan",ChIJqRViPUbyaS4RWCZ0G5hXc0A,0.018828399999999412
warteg jaya makmur,0,0,-6.2658181,106.8442605,"jl. raya pasar minggu, rt.13/rw.1, pejaten tim., kota jakarta selatan",ChIJHdODV0jyaS4RZvtForGZfpo,0.017823299999996323
warteg kharisma bahari,3.8,21,-6.253233,106.8373344,"jl. duren tiga raya no.41, rt.5/rw.6, duren tiga, kota jakarta selatan",ChIJYwBuaqbzaS4Rc_bfFtZiX4c,0.022593499999996602
warteg asri bahari,4.6,17,-6.2575743,106.857948,"jl. binawarga no.2, rt.5/rw.5, rawajati, south jakarta city",ChIJ-Z-XQqvzaS4RDIBOECjZoOQ,0.004107999999992451
warteg dapuk,4.1,113,-6.253419900000001,106.8384314,"jl. duren tiga selatan, rt.3/rw.6, duren tiga, kota jakarta selatan",ChIJpbbHNhfzaS4RXx6_ORxH6x8,0.021309599999994155
warteg pesona bahari,4.5,6,-6.2532369,106.8426154,"jl. raya pasar minggu no.46, rt.3/rw.7, duren tiga, kota jakarta selatan",ChIJtb4l6bXzaS4RroOmPgeOchY,0.017308599999999785
warteg sampurna jaya,4.3,39,-6.257811900000001,106.8576985,"jl. rawajati timur no.1 no.1, rt.4/rw.1, rawajati, kota jakarta selatan",ChIJS2xxOFPyaS4Rf8kU7_Cveqk,0.003620899999996041
warteg ugi jaya,0,0,-6.249038199999999,106.8596685,"jl. pengadegan timur ii, rt.4/rw.1, pengadegan, kota jakarta selatan",ChIJpUbl1qjzaS4R221fy8pd2MM,0.01436459999999773
warteg bahari,5,1,-6.2457579,106.8591311,"jl. pengadegan utara no.10, rt.4/rw.2, cikoko, kota jakarta selatan",ChIJC86dsLvzaS4RiELAZPEfFh0,0.017107499999998055
warteg rr,0,0,-6.258087499999999,106.8596138,"plaza kalibata lantai basement, jl. kali bata raya, no. 1, rt.2/rw.7, rawajati, kota jakarta selatan",ChIJPX23o1TyaS4RJgM-E2fdgW0,0.005260600000005056
warteg pancoran,4.2,67,-6.262366099999999,106.8458853,"jl. kalibata timur no.49, rt.9/rw.8, kalibata, kota jakarta selatan",ChIJBf9O3kvyaS4RfEJORj-sS-w,0.012746499999993333
warteg ibu riska,4.4,15,-6.2480734,106.8533372,"jl. pengadegan bar. v no.19, rt.5/rw.7, pengadegan, kota jakarta selatan",ChIJOYI94K_zaS4Rd9nmHGB26iI,0.01175030000000099
warteg nabil,5,1,-6.250932,106.8572151,"jl. pengadegan timur no.6, rt.8/rw.4, cikoko, kota jakarta selatan",ChIJZyJ2zCbzaS4RgaWJHXXzB7c,0.010017400000004173
warteg nan bahari,5,3,-6.246048,106.8589859,"jl. cikoko timur raya no.35, rt.3/rw.1, cikoko, kota jakarta selatan",ChIJleKw0PLzaS4Rqs4en8czoYA,0.016672199999992365
warteg jaya makmur,4.1,13,-6.247274,106.842307,"jl. raya psr minggu, rt.1/rw.4, pancoran, kota jakarta selatan",ChIJ9coSHbjzaS4R2kA_O_yILi8,0.023579899999994325
warteg jaya makmur,5,4,-6.2411759,106.8446499,"jl. prof. dr. soepomo no.7, rt.4/rw.1, menteng dalam, kota jakarta selatan",ChIJYwXw0eXzaS4R2BJWYmrH6xs,0.027335100000006385
warteg fitri,4.6,26,-6.251899,106.867851,"jalan masjid bendungan #6 dewi sartika cawang, rt.7/rw.10, cawang, dki jakarta",ChIJB4fP1QDzaS4RQ--nrw9sgKs,0.019686300000000934
wahyoo warteg anugrah,5,1,-6.2672571,106.8374,"jl. siaga raya no.9, rt.14/rw.4, pejaten bar., kota jakarta selatan",ChIJzUyWbjfyaS4R0FBhXmuLbwo,0.02612279999999867
warteg rinjani,4.9,55,-6.2681949,106.8400081,"gang f no.19 rt 12, rt.1/rw.1, pejaten bar., kota jakarta selatan",ChIJCTcN-EfyaS4R-7UcC_gPMMk,0.024452499999995325
warteg rava,4,8,-6.2495841,106.8513794,"jl. pancoran timur raya no.54f, rt.6/rw.8, pengadegan, kota jakarta selatan",ChIJL_-fTLDzaS4RrwSr0GG_lDY,0.012197400000000691
warteg kowantara jaksel,4.4,13,-6.2465069,106.8570923,"jl. pengadegan utara no.6a, rt.7/rw.2, cikoko, kota jakarta selatan",ChIJZRk7j6XzaS4RiqZ1XOtDkSM,0.014319700000004154
warteg sederhana purbaya,5,1,-6.272487,106.8467249,"jl. purbaya no.11, rt.11/rw.5, pejaten tim., kota jakarta selatan",ChIJw-bjRWbzaS4RK-wqkq5nedw,0.022027800000002706
dapur warteg putra jaya,3.8,10,-6.2586857,106.8368179,"jl. gajah mungkur, rt.11/rw.3, duren tiga, jakarta",ChIJMak7vzTyaS4RL7jm4GLN5ho,0.018133500000001135
