nama_tempat,rating_tempat,user_ratings_total,latitude,longitude,alamat_tempat,place_id,distance
warteg latifah,4.6,42,-6.2571283,106.8169117,"prv8+4qv, rt.5/rw.1, bangka, south jakarta city",ChIJc-5_wn_xaS4RRhfzbFQQ6B8,0
warteg bejo,4.5,114,-6.258194599999999,106.8134351,"jl. kemang i no.12, rt.10/rw.1, bangka, kota jakarta selatan",ChIJZVTwuK_xaS4RHEFvuzuSxyw,0
warteg kharisma bahari,4.4,134,-6.2641376,106.8090111,"jl. khm. naim iii no.11, rt.5/rw.9, cipete utara, kota jakarta selatan",ChIJ32eNfYTxaS4RPMzLYLN43zk,0
warteg kharisma bahari,4.3,3,-6.2571621,106.8184548,"jl. kemang barat no.16, rt.6/rw.5, bangka, kota jakarta selatan",ChIJOxi72bzzaS4RlvjFPBNt4kc,0
warteg mojo,3.9,15,-6.2517871,106.8170368,"jl. bangka ix no.100, rt.3/rw.12, pela mampang, kota jakarta selatan",ChIJNdOYjH3xaS4Rk1oL3l1tnB0,0
warteg jippo,4.5,6,-6.257980799999999,106.8071943,"jl. anggur v, rt.3/rw.3, cipete utara, kota jakarta selatan",ChIJOSU7EnjxaS4R_IVdjn8r26A,0
simpang raya rm warteg kecil,4.6,14,-6.2572807,106.816164,"jl. kemang utara, rt.4/rw.1, bangka, kota jakarta selatan",ChIJ6ZkBlX_xaS4RHQ5_31o7o94,0
warteg sederhana,4.4,48,-6.264538000000001,106.8089784,"jl. khm. naim iii b no.11, rt.7/rw.9, cipete utara, kota jakarta selatan",ChIJMWiYWoTxaS4R7M_b64dog7Y,0
warteg abil jaya,4.3,36,-6.251912799999999,106.8179044,"jl. bangka ix, rt.3/rw.12, pela mampang, kota jakarta selatan",ChIJbWYTINbzaS4R30dW265Wz7s,0
warteg hidayah,4.4,19,-6.288495999999999,106.8070396,"jl. pangeran antasari gg. swadaya iii, rt.1/rw.1, cilandak bar., kota jakarta selatan",ChIJo4IhF_DxaS4R6ClUf1MaOcY,0
warteg mpr,4.4,54,-6.284384999999999,106.8066329,"jl. m.p.r iii no.dalam, rt.12/rw.13, cilandak bar., kota jakarta selatan",ChIJcbdCnQ_xaS4RmrM1BqjXTjs,0
warteg mitra,4.8,5,-6.291395,106.802194,"jalan cilandak tengah iv no. 14c rt.003/001, rt.3/rw.1, cilandak bar., kota jakarta selatan",ChIJvx31k13xaS4Rm_CEsaEukh8,0
warteg aw,5,2,-6.28499,106.8065595,"jln mpr 3 dalam no34, jl. m.p.r iii dalam no.dalam, rt.2/rw.13, cilandak bar., kota jakarta selatan",ChIJhbqPfJnxaS4RpwayWTz8Ba4,0
warteg brambang salam,4.5,4,-6.2892606,106.8030518,"jl. cilandak tengah ii no.10, rt.3/rw.1, cilandak bar., kota jakarta selatan",ChIJKwtXf-_xaS4RMB6kW-c9w-s,0
warteg subsidi,5,1,-6.292541,106.810897,"jl. pam lama no.48, rt.2/rw.1, cilandak tim., kota jakarta selatan",ChIJD5CtJL_xaS4RaxCzYI7-O6k,0
warteg citr sari,4.4,36,-6.2948572,106.8108821,"jl. jaha no.12, rt.4/rw.1, cilandak tim., kota jakarta selatan",ChIJa26PDvzxaS4RPcEvbwGIn2o,0
warteg mitra,5,1,-6.289324,106.80192,"jl. cilandak tengah raya, rt.2/rw.1, cilandak bar., kota jakarta selatan",ChIJpeh2ueXxaS4RcRkr1GzS7ZI,0
warteg asih,4.6,55,-6.287616,106.809292,"jl. nis no.32, rt.9/rw.3, cilandak tim., kota jakarta selatan",ChIJWQqmRYXxaS4R7CAIOdaA5Ag,0
warteg,0,0,-6.2893219,106.8066429,"jl. swadaya no.16a, rt.2/rw.1, cilandak bar., kota jakarta selatan",ChIJeYO0IDrxaS4RzjAiFuMYOtg,0
wahyoo warteg bmj,5,1,-6.2891726,106.8030902,"pr63+86p, rt.7/rw.1, west cilandak, south jakarta city",ChIJ_3Z-_XjxaS4RT3bKsAq4fAY,0
warteg idola,4.5,86,-6.2493022,106.7837738,"jl. bungur ii, rt.4/rw.2, kby. lama sel., dki jakarta",ChIJ75L4HhDxaS4RgYOwHHC9nog,0
warteg kharisma bahari - kostrad,4.5,19,-6.2533197,106.7852406,"jl. darma putra raya jl. swadaya no.51, rt.9/rw.5, kby. lama sel., kota jakarta selatan",ChIJ78_ZKA_xaS4RjhU79awBWnI,0
wahyoo warteg mekarsari,4.5,79,-6.2522474,106.7833053,"dalam k nomor, jl. praja no.40, rt.7/rw.5, kby. lama sel., kota jakarta selatan",ChIJNS1Wdg_xaS4RQUMIMTYVufw,0
wahyoo warteg hidayah,0,0,-6.249195599999999,106.7826033,"jl. bungur ii no.57, rt.2/rw.2, kby. lama sel., kota jakarta selatan",ChIJ-X5OABDxaS4RtSLrS7TkDtw,0
warteg barokah,4.8,4,-6.247303899999999,106.7797712,"jl. bungur, rt.4/rw.1, kby. lama utara, kota jakarta selatan",ChIJwahg_BrxaS4RNRojSe6S7EQ,0
warteg ana,5,3,-6.248831099999999,106.7843621,"jalan bungur ii rw003, rt.4/rw.12, kby. lama sel., kec. kby. lama, kota jakarta selatan, dki jakarta12240, rt.5/rw.2, kby. lama sel., kota jakarta selatan",ChIJLdK__YTxaS4RnAEzfcP6EOg,0
warteg mubarok,4.3,11,-6.2499981,106.7900569,"jl. antena ii no.17, rt.3/rw.8, kramat pela, kota jakarta selatan",ChIJMRQqlw3xaS4RAbC3wsz1ewQ,0
warteg raji,4.3,4,-6.2583739,106.7824829,"jl. tanah kusir ii no.9, rt.3/rw11/rw.9, kby. lama sel., kota jakarta selatan",ChIJUT0qYJfxaS4RWNnA0Jb0FOI,0
warteg selasih,5,2,-6.2568402,106.7857907,"jl. taman radio dalam vii, rt.13/rw.11, gandaria utara, kota jakarta selatan",ChIJT0T3qQnxaS4RHNgaUwtW9r8,0
warteg waluyo,4.2,11,-6.2599342,106.7845167,"jl. kopro banjir, rt.7/rw.11, kby. lama sel., kota jakarta selatan",ChIJ1Z8Ij6fxaS4Rw9PgmuWtJbs,0
warteg munawar,4.5,17,-6.2598405,106.7852074,"jl. dwijaya iv, rt.7/rw.11, kby. lama sel., kota jakarta selatan",ChIJ48rKg6fxaS4RdVX2uuxZPIQ,0
warteg (wahyoo) enno,5,4,-6.2498542,106.7915148,"jl. radio dalam raya no.2, rt.14/rw.2, gandaria utara, kota jakarta selatan",ChIJn2kcbrrxaS4RrbmUrkJi46s,0
warteg kharisma,4.3,13,-6.246765099999999,106.7882461,"jl. jatayu no.rt.7, rt.8/rw.3, south kebayoran lama, south jakarta city",ChIJwTFnhBHxaS4RUnkcZqdgsTI,0
wahyoo warteg berkah bahari,5,1,-6.2532236,106.7842465,"jl. praja no.dalam, rt.5/rw.5, south kebayoran lama, south jakarta city",ChIJydRgLtzxaS4RhDc26tp6fU0,0
wahyoo warteg sederhana,4.4,16,-6.2579637,106.7897662,"jl. minang kramat no.1b, rt.2/rw.14, gandaria utara, kota jakarta selatan",ChIJzzW9PwrxaS4RdKXd702mxKs,0
warteg waluyo,4.2,11,-6.2599342,106.7845167,"jl. kopro banjir, rt.7/rw.11, kby. lama sel., kota jakarta selatan",ChIJ1Z8Ij6fxaS4Rw9PgmuWtJbs,0
warteg raji,4.3,4,-6.2583739,106.7824829,"jl. tanah kusir ii no.9, rt.3/rw11/rw.9, kby. lama sel., kota jakarta selatan",ChIJUT0qYJfxaS4RWNnA0Jb0FOI,0
warteg tono,3.9,32,-6.260771099999999,106.7853106,"jl. tanah kusir no.09, rt.10/rw.11, kby. lama sel., kota jakarta selatan",ChIJCcdCn6fxaS4RYkFXDuUBQXU,0
warteg munawar,4.5,17,-6.2598405,106.7852074,"jl. dwijaya iv, rt.7/rw.11, kby. lama sel., kota jakarta selatan",ChIJ48rKg6fxaS4RdVX2uuxZPIQ,0
warteg selasih,5,2,-6.2568402,106.7857907,"jl. taman radio dalam vii, rt.13/rw.11, gandaria utara, kota jakarta selatan",ChIJT0T3qQnxaS4RHNgaUwtW9r8,0
warteg kharisma bahari - kostrad,4.5,19,-6.2533197,106.7852406,"jl. darma putra raya jl. swadaya no.51, rt.9/rw.5, kby. lama sel., kota jakarta selatan",ChIJ78_ZKA_xaS4RjhU79awBWnI,0
warteg citra bahari,3.6,10,-6.253381,106.77607,"jalan bintaro raya tanah kusir, rt.2/rw.10, kebayoran lama selatan, kebayoran lama, rt.11/rw.10, kby. lama sel., kota jakarta selatan",ChIJo7yAjAPxaS4Rj1TMzLIGzlE,0
warteg dewi,4.6,17,-6.259367,106.7829055,"jl. tanah kusir ii no.9 rt009/rw009, rt.11/rw.9, kby. lama sel., kota jakarta selatan",ChIJ24TL8y7xaS4Rwwv4UwE3Hok,0
warteg m j,4.4,15,-6.260880299999999,106.7888184,"jl. radio dalam raya no.88, rt.3/rw.11, gandaria utara, kota jakarta selatan",ChIJHQ3F06DxaS4R5gBp0MQxEnw,0
warteg ainun jaya 1 - tanah kusir,4.3,17,-6.2549179,106.7776599,"jl. ciputat raya jl. tanah kusir no.47, rt.13/rw.1, kby. lama sel., kota jakarta selatan",ChIJFdYstSrxaS4RDR2FalWmrFE,0
warteg slawi ayu,4.6,60,-6.2553325,106.7760395,"jl. johari no.1, rt.10/rw.10, kby. lama sel., kota jakarta selatan",ChIJdUouTgHxaS4RkjXb5A6rWb4,0
wahyoo warteg mekarsari,4.5,79,-6.2522474,106.7833053,"dalam k nomor, jl. praja no.40, rt.7/rw.5, kby. lama sel., kota jakarta selatan",ChIJNS1Wdg_xaS4RQUMIMTYVufw,0
warteg irma,0,0,-6.253249299999999,106.7778802,"jl. ciputat raya no.2, rt.11/rw.11, kby. lama utara, kota jakarta selatan",ChIJTe_1agTxaS4RTRdADsChwg4,0
warteg dewi,5,3,-6.262671399999999,106.7855896,"jl. margaguna raya a no.9, rt.4/rw.15, gandaria utara, kota jakarta selatan",ChIJxyiN96bxaS4R-q2adJP7T-8,0
warteg portugal,4.2,17,-6.2580774,106.7773531,"jl. ciputat raya, rt.4/rw.10, kby. lama sel., kota jakarta selatan",ChIJ93oZOgfxaS4RPF6_rk3M1P4,0
