nama_tempat,rating_tempat,user_ratings_total,latitude,longitude,alamat_tempat,place_id,distance
warteg warmo,4.1,3319,-6.230143,106.8523994,"jl. tebet timur raya no.1d, rt.8/rw.10, tebet tim., kota jakarta selatan",ChIJez1HhZDzaS4RDzWl0w4Y-5E,0.012825199999999093
warteg bahari,4.5,12,-6.2355784,106.842835,"jl. masjid an nur no.24a, rt.4/rw.2, menteng dalam, kota jakarta selatan",ChIJlXALPpXzaS4RrjkhZxIhv9I,0.027825000000000877
warteg putra bahari 112,4.9,20,-6.231840999999999,106.85273,"8, jl. tebet timur raya no.18d, rt.8/rw.10, east tebet, south jakarta city",ChIJz6k9KtvzaS4R2OKeQIHyhbs,0.014192600000000333
warteg nojo jaya,4.6,8,-6.2350157,106.8600161,"jl. asem baris raya no.36a, rt.4/rw.6, kb. baru, kota jakarta selatan",ChIJtUT4Op_zaS4R5XX7ufYQ850,0.014786200000000527
warteg,3,1,-6.2187167,106.8612924,"jl. bukit duri no.30, rt.10/rw.6, bukit duri, kota jakarta selatan",ChIJjxOZ13_zaS4R6gMhRnEeuG0,0.007494100000001502
warteg mulya,4.9,10,-6.22113,106.846073,"jl. dr. saharjo, rt.4/rw.5, menteng atas, kota jakarta selatan",ChIJ1w_j8ovzaS4RWFhXncsmwEs,0.013042599999991467
warteg bahari.in,5,2,-6.220841099999999,106.8498442,"jl albarkah no 30 rt 06/rw 03 kel, rt.6/rw.3, manggarai sel., kota jakarta selatan",ChIJS3btx1DzaS4RgweaHWbNokg,0.009560299999989752
warteg barokah,4.3,10,-6.2300781,106.8526646,"jl. tebet timur raya no.32d, rt.9/rw.10, tebet tim., kota jakarta selatan",ChIJB2JJXLzzaS4Rl38TLDDvUEk,0.012495099999997983
warteg berkah,4.1,13,-6.222289099999999,106.8446667,"jl. menteng pulo 1 no.14, rt.15/rw.5, menteng dalam, kota jakarta selatan",ChIJHQAA84zzaS4RdP7KBSg8FSc,0.013289799999991025
warteg bahari,4.6,5,-6.2273648,106.8580821,"3, jl. tebet timur dalam ii no.1, rt.1/rw.3, tebet tim., kota jakarta selatan",ChIJszqGRJvzaS4RfYVqRQsB5AE,0.00520130000000929
warteg putri,3.3,3,-6.2191892,106.852938,"jl. bukit duri selatan no.5, rt.9/rw.3, bukit duri, kota jakarta selatan",ChIJRXpbgYjzaS4RV1hv9D-ZtxA,0.008118400000000747
warteg ibu mukrim,4.5,25,-6.228701699999999,106.8517258,"qvc2+gm9, rt.15/rw.1, west tebet, south jakarta city",ChIJqViFXZDzaS4RYuxEuo2HLgE,0.01205749999999739
warteg bahari mas bambang,5,2,-6.2131298,106.844983,"jl. padang panjang no.8, rt.5/rw.8, ps. manggis, kota jakarta selatan",ChIJC52MDHX0aS4RkWm1iqLJzhE,0.022132799999996067
warteg baru,5,2,-6.2111319,106.8400303,"jl. menteng bata, rt.15/rw.7, ps. manggis, kota jakarta selatan",ChIJmWORogz0aS4R5_U6TpLzv8E,0.029083400000000204
warteg jaya bahari,4.3,71,-6.229081799999999,106.8589533,"qvc5+9h8, rt.4/rw.5, kebon baru, south jakarta city",ChIJv7OqgZvzaS4RReSkChFTU5c,0.00778949999999945
warteg kharisma,4.2,18,-6.239914,106.84741,"jl. tebet barat dalam vii no.5 a, rt.9/rw.6, tebet bar., kota jakarta selatan",ChIJ677FKbzzaS4RXgH8C4vnh9k,0.027585599999998323
warteg bahari berkah,0,0,-6.233874399999999,106.8568334,"jl. tebet timur dalam raya no.rt.004, rt.4/rw.5, tebet tim., kota jakarta selatan",ChIJo64jEZXzaS4RvUg2XuXUamc,0.012122599999994321
wahyoo warteg bahari,4.6,9,-6.2094722,106.8503081,"jl. manggarai utara 2 no.17, rt.15/rw.4, manggarai, kota jakarta selatan",ChIJKxIy4nD0aS4R6b7QncHtuA4,0.02046529999998814
warteg rasamala,4,104,-6.2361868,106.8402147,"jl. rasamala raya no.24, rt.9/rw.2, menteng dalam, kota jakarta selatan",ChIJ802RvurzaS4Rx2pin99rm7A,0.031053699999990414
warteg barokah indah,4.5,2,-6.210892,106.861029,"jalan nomor #4 palmeriem jalan kh ahmad dahlan, jl. kh. ahmad dahlan, rt.5/rw.9, palmeriam, dki jakarta",ChIJMSg4J3z0aS4RfUV-qm3GIiU,0.015055400000006713
warteg 21,4.8,19,-6.2211618,106.8448696,"jl. pendawa no.2, rt.3/rw.5, menteng dalam, kota jakarta selatan",ChIJN8xhrefzaS4ReYI0FQkdFi0,0.014214199999999622
warteg subur jaya,3.5,2,-6.2386555,106.8604565,"jl. asem baris raya no.115, rt.3/rw.11, kb. baru, kota jakarta selatan",ChIJrYJSlqHzaS4RqVK2H3B34Vo,0.018866400000002947
warteg ridho ibu,4.6,15,-6.240116,106.8452333,"jl. prof. dr. soepomo no.31, rt.4/rw.1, menteng dalam, kota jakarta selatan",ChIJY5BMw77zaS4RcRklqw5XtMI,0.029964299999991617
warteg ridho ibu,3,1,-6.2355081,106.8570736,"jl. tebet timur dalam raya no.2, rw.6, tebet tim., kota jakarta selatan",ChIJX1PskpjzaS4RgD_4nr4402o,0.01351609999998793
warteg maun jaya,4.8,6,-6.2185941,106.8452144,"jalan dokter saharjo, rt.1/rw.4, manggarai sel., kota jakarta selatan",ChIJY7fqT4rzaS4RpXeI2d90cpo,0.0164370999999921
warteg sri,4.1,16,-6.233523000000001,106.8651764,"jl. f bawah no 35 rt/rw. 008/008 12830, rt.8/rw.8, kb. baru, kota jakarta selatan",ChIJqYbNgHXzaS4R-cNXpaQAU9M,0.018453800000001408
warteg murni,4.5,2,-6.208837399999999,106.8421317,"jl. menteng wadas timur, rt.9/rw.2, ps. manggis, kota jakarta selatan",ChIJCf792XL0aS4RZMOSt7Da3DI,0.029276499999999928
warteg gaul,4.5,6,-6.229657899999999,106.8582529,"jl. tebet timur dalam ii, rt.6/rw.3, tebet tim., kota jakarta selatan",ChIJYYaxmpvzaS4Riyrd5B0_j3M,0.007665200000000816
warteg podomoro 3,5,1,-6.2321442,106.8441351,"jalan merpati 3 no.26, rt.1/rw.3, menteng dalam, kota jakarta selatan",ChIJBzn-f5PzaS4R17_-nsHYGso,0.023090699999992026
warteg febri,4.1,9,-6.2229266,106.8449343,"jl. pendawa, rt.14/rw.5, menteng dalam, kota jakarta selatan",ChIJcwt1Z4zzaS4Ra-Zsp1fdunY,0.013073899999989536
warteg bu ipah,5,2,-6.230258699999999,106.8523018,"no., jl. tebet raya no.15, rt.8/rw.10, tebet tim., kota jakarta selatan",ChIJK3v_lpDzaS4R4vRnQ8m4nUI,0.013038499999987962
warteg bahari pakde sukram,4.9,30,-6.220428,106.8482647,"jl albarkah no 18a rt 13/rw 04 kel, rt.13/rw.4, manggarai sel., kota jakarta selatan",ChIJF8RTXUPzaS4ROzbGmkZix7s,0.011552899999993649
warteg ibu mulus,4.7,32,-6.222481699999999,106.8590161,"jl. bukit duri tanjakan no.58, rt.1/rw.8, bukit duri, kota jakarta selatan",ChIJ4y2TCoTzaS4RGr44il_yChU,0.0014528000000115782
warteg tasya,4.5,51,-6.229188,106.8516545,"jl. tebet barat raya, rt.14/rw.1, tebet bar., kota jakarta selatan",ChIJBT53xGrzaS4RH6BnYXB2z3c,0.012615099999999657
warteg sumber rejeki,4.3,33,-6.210910999999999,106.843766,"jalan sawah lunto no.20 rt 4 rw 01, kelurahan pasar manggis, kecamatan setiabudi, rt.14/rw.1, ps. manggis, kota jakarta selatan",ChIJZ7iqc3P0aS4RxJ0_RQDhe7U,0.025568599999993502
warteg emak,4.6,11,-6.222114899999999,106.8409979,"jl. menteng pulo ii no.8, rt.16/rw.12, menteng dalam, kota jakarta selatan",ChIJddVfNPPzaS4RKVPQVOTT8gs,0.017132799999990844
warteg maharani,4.6,32,-6.212605,106.8534196,"jalan manggarai utara 6 no.1, rt.7 no.1, rt.8/rw.1, manggarai, kota jakarta selatan",ChIJMZR033n0aS4RpxwD9aTvQ2U,0.01422100000000004
warteg kharisma bahari cb.saharjo,3.9,43,-6.215278,106.843964,"qrmv+vhp, rt.8/rw.10, south manggarai, south jakarta city",ChIJzcToiGP1aS4RoVKibqNQcOA,0.021003599999995792
warteg vokoke wareg,0,0,-6.234931,106.851563,"jl. tebet barat raya, rt.4/rw.7, tebet bar., kota jakarta selatan",ChIJo5qIHz7zaS4RHUDp-mPHyoE,0.018449599999995847
warteg kharisma,4.9,9,-6.238396799999999,106.8473758,"jl. tebet barat dalam iv, rt.15/rw.6, tebet bar., kota jakarta selatan",ChIJt8or7tDzaS4R-H8EdwDC7z8,0.026102599999999754
warteg satria,4.5,101,-6.234213599999999,106.84669,"jl. tebet barat dalam raya no.9, rt.8/rw.2, tebet bar., kota jakarta selatan",ChIJD1kzWe3zaS4Rav1WOP5rHZk,0.022605199999998327
warteg merdeka,4.8,5,-6.2216344,106.8622363,"gg. h. abu no.11, rt.12/rw.10, bukit duri, kota jakarta selatan",ChIJH2g3QBfzaS4R3K1lhTt7lMs,0.005520300000011247
warteg karunia rahayu,4.2,18,-6.219502400000001,106.8427692,"jl. subur dalam no.8, rt.4/rw.8, menteng atas, kota jakarta selatan",ChIJfWmaIYvzaS4RURpv4xrH_Nw,0.017973999999987278
warteg berkah,5,1,-6.221354,106.842741,"jl. menteng pulo no.4, rt.5/rw.9, menteng atas, kota jakarta selatan",ChIJJS43VVTzaS4RMhUCYQDXpcE,0.016150599999991577
warteg ertiga bahari,4.9,9,-6.21843,106.853403,"jl bukitduri barat rt4/rw1, kel bukitduri, kectebet, rt.4/rw.1, bukit duri, kota jakarta selatan",ChIJJTNd14fzaS4RdyaxXlCpFWo,0.00841259999999533
warteg cahaya baru,4.9,7,-6.235236,106.844091,"jalan prof. dr. soepomo no. 145b rrt. 07/01, menteng dalam, tebet, rt.7/rw.1, menteng dalam, kota jakarta selatan",ChIJhUGeCJXzaS4RQDxlB2kfUOw,0.026226599999988665
warteg riski,4.6,32,-6.2170675,106.8618326,"4, jl. bukit duri utara no.18, rt.3/rw.12, bukit duri, kota jakarta selatan",ChIJ-zXGi4DzaS4RYMs552Zw6DI,0.009683500000004841
