nama_tempat,rating_tempat,user_ratings_total,latitude,longitude,alamat_tempat,place_id,distance
warteg ibu mukrim,4.4,9,-6.2294415,106.8078555,"jalan tebet barat raya no 71 a rt 15 rw 01, gang keamanan no.2, rt.7/rw.3, senayan, dki jakarta",ChIJtTxgoVrxaS4RIcILCJ94784,0.02165129999999671
warteg bahari,4.3,8,-6.243084899999999,106.8036004,"rt.5/rw.2, melawai, kota jakarta selatan",ChIJnR10wNHxaS4RW1jJIolVFBg,0.0037527999999893424
warteg gaspoll,4.6,37,-6.23992,106.811888,"santa modern market, lantai 2 no. 171-172, rt.5/rw.4, petogogan, kota jakarta selatan",ChIJox4BmHnxaS4R391rlmpggsA,0.015205299999990984
warteg putra bahari,4.3,4,-6.2456577,106.819603,"rt.2/rw.3, pela mampang, kota jakarta selatan",ChIJVVVVaNjzaS4RyixQLFrqka8,0.01879459999999522
warteg saleh jaya,4.6,21,-6.244921,106.810186,"jalan petogogan ii no.30p, pulo, rt.9/rw.5, petogogan, kota jakarta selatan",ChIJeVL2pHTxaS4RiuAtQ7S6Qkg,0.008640899999996066
warteg bu turah,4.4,31,-6.2613799,106.802347,"jakarta selatan, rt.6/rw.2, cipete utara, kota jakarta selatan",ChIJIwFTrZ3xaS4R8yZkk2Jr6pU,0.01726079999999186
warteg barokah,3.8,15,-6.258563,106.802274,"no 18, jalan kirai, rt.10/rw.4, cipete utara, kota jakarta selatan",ChIJK_7-mZ3xaS4RG3fPlGRAtKc,0.014370899999991416
warteg selera,4,1,-6.2610981,106.7910983,"jl. hidup baru no.30, rt.12/rw.3, gandaria utara, kota jakarta selatan",ChIJ1ZlaW6DxaS4Ro0zW8V-AUa0,0.026762500000003797
warteg nojo jaya,4.3,52,-6.2464479,106.8187618,"jl. bangka ii no.44b, rt.1/rw.3, pela mampang, kota jakarta selatan",ChIJx7Z8btjzaS4RPtfQJN3azZ0,0.01874359999999875
warteg nojo jaya,4.1,130,-6.2369222,106.8169473,"jl. rengas 3 no.1, rt.7/rw.2, rw. bar., kota jakarta selatan",ChIJe36y7V_xaS4Rg4XGMfLfIX0,0.02326239999998947
warteg nojo jaya ciragil,4.2,113,-6.2374415,106.8093958,"jl. cikatomas no.12, rt.5/rw.1, rw. bar., kota jakarta selatan",ChIJSfF6m13xaS4RA4-iuuueqIg,0.01519159999999875
warteg bahari jaya,0,0,-6.2390041,106.8188734,"jl. kapten tendean, rt.6/rw.5, kuningan bar., kota jakarta selatan",ChIJ-RZCiKvzaS4RtAav75WND64,0.02310659999999576
warteg bahari,3.4,5,-6.230443999999999,106.785361,"jl. rawa simprug ix b no.7, rt.6/rw.9, grogol sel., kota jakarta selatan",ChIJPyls_jrxaS4RmyaV7fGd8Cw,0.03066110000001121
warteg zahra,4.2,17,-6.2524679,106.7945975,"jl. petogogan i no.20a, rt.1/rw.11, gandaria utara, kota jakarta selatan",ChIJkTt21XLxaS4RJPViggvKqAg,0.014633100000010835
warteg citrajaya bahari,4.1,12,-6.259934500000001,106.7962051,"jl. gotong royong i no.1, rt.4/rw.6, gandaria utara, kota jakarta selatan",ChIJ9fn8wp_xaS4Rnr_xEDKeXI0,0.02049210000001178
warteg barokah,5,2,-6.2362479,106.783932,"jl. nasional 12, rt.5/rw.1, kby. lama utara, kota jakarta selatan",ChIJm92c4DzxaS4R3xzQMk6XG4o,0.026286200000011917
warteg selera,4.6,13,-6.260402999999999,106.7970268,"jl. rs. fatmawati raya no.1, rt.2/rw.1, cipete utara, kota jakarta selatan",ChIJzRY0eXXxaS4RDvXmGhnQD4Y,0.020138900000007176
warteg latifah,4.6,42,-6.2571283,106.8169117,"prv8+4qv, rt.5/rw.1, bangka, south jakarta city",ChIJc-5_wn_xaS4RRhfzbFQQ6B8,0.02757390000000015
warteg sederhana,4.7,11,-6.248002,106.816425,"5 no, jl. bangka no.13, rt.10/rw.3, pela mampang, dki jakarta",ChIJw3WatWLxaS4RRAE587JshQE,0.01796089999998962
warteg kharisma bahari 16,4.5,16,-6.260229799999999,106.7909705,"cilandak, jl. h. salim 1 no.3, rt.8/rw.10, gandaria utara, dki jakarta",ChIJDdcAxKDxaS4R_DT2xRvkiFk,0.026022000000004653
warteg bahari velbak,5,1,-6.2393284,106.7850884,"komplek perkantoran kebayoran baru mall, jl. kebayoran baru no.4, rt.4/rw.7, gunung, kota jakarta selatan",ChIJc_XjEL_xaS4R-Ll2yi00gt4,0.02204929999999905
warteg xii mutiara bahari,4.8,6,-6.2456644,106.8155586,"rt.1/rw.11, pela mampang, kota jakarta selatan",ChIJ-1nXV2LxaS4RZv5LRU6mKHY,0.014756899999997408
warteg bowo,4.8,8,-6.241123,106.791073,"jl. tebah ii no.115, rt.14/rw.3, gunung, kota jakarta selatan",ChIJnft4VK_xaS4RDM-zRemp4Ss,0.014270100000008057
warteg kharisma bahari,4.4,179,-6.260070100000001,106.8057715,"jl. h. jian no.32, rt.7/rw.3, cipete utara, kota jakarta selatan",ChIJx8p0Sp3xaS4R-_IldqY_PHc,0.019375500000001544
warteg waluyo,4.2,11,-6.2599342,106.7845167,"jl. kopro banjir, rt.7/rw.11, kby. lama sel., kota jakarta selatan",ChIJ1Z8Ij6fxaS4Rw9PgmuWtJbs,0.032180200000007986
warteg mojo,3.9,15,-6.2517871,106.8170368,"jl. bangka ix no.100, rt.3/rw.12, pela mampang, kota jakarta selatan",ChIJNdOYjH3xaS4Rk1oL3l1tnB0,0.0223577999999911
wahyoo warteg sederhana,4.4,16,-6.2579637,106.7897662,"jl. minang kramat no.1b, rt.2/rw.14, gandaria utara, kota jakarta selatan",ChIJzzW9PwrxaS4RdKXd702mxKs,0.02496020000000332
warteg idola,4.5,86,-6.2493022,106.7837738,"jl. bungur ii, rt.4/rw.2, kby. lama sel., dki jakarta",ChIJ75L4HhDxaS4RgYOwHHC9nog,0.022291099999999453
warteg bejo,4.5,114,-6.258194599999999,106.8134351,"jl. kemang i no.12, rt.10/rw.1, bangka, kota jakarta selatan",ChIJZVTwuK_xaS4RHEFvuzuSxyw,0.025163599999999953
warteg jaya bahari,4.6,5,-6.241229,106.8177995,"jl. bangka raya no.10, rt.2/rw.1, pela mampang, kota jakarta selatan",ChIJVYhx2GHxaS4R8ZbmSUf-62k,0.019807800000001485
warteg berkah,4.5,21,-6.2451104,106.7937817,"jalan barito, rt.3/rw.1, kramat pela, kota jakarta selatan",ChIJ_fAfNhPxaS4RO0NcipMGV5A,0.00809140000000852
warteg kharisma bahari,4.3,3,-6.2571621,106.8184548,"jl. kemang barat no.16, rt.6/rw.5, bangka, kota jakarta selatan",ChIJOxi72bzzaS4RlvjFPBNt4kc,0.029150799999992927
warteg m j,4.4,15,-6.260880299999999,106.7888184,"jl. radio dalam raya no.88, rt.3/rw.11, gandaria utara, kota jakarta selatan",ChIJHQ3F06DxaS4R5gBp0MQxEnw,0.028824600000008083
warteg jippo,4.5,6,-6.257980799999999,106.8071943,"jl. anggur v, rt.3/rw.3, cipete utara, kota jakarta selatan",ChIJOSU7EnjxaS4R_IVdjn8r26A,0.01870899999999942
warteg jaya,3,1,-6.237504,106.814933,"#, jl. birah ii no.4, rt.6/rw.6, rw. bar., kota jakarta selatan",ChIJy_TP0l_xaS4RN33VNof7puc,0.02066629999999048
warteg tono,3.9,32,-6.260771099999999,106.7853106,"jl. tanah kusir no.09, rt.10/rw.11, kby. lama sel., kota jakarta selatan",ChIJCcdCn6fxaS4RYkFXDuUBQXU,0.03222320000000156
warteg kharisma bahari,4.4,206,-6.2582684,106.7932268,"jl. karya utama no.6, gandaria utara, kota jakarta selatan",ChIJx1eskX_xaS4R07OKpVGmurM,0.02180430000000655
warteg timbul jaya 4,4.1,13,-6.2494235,106.817759,"no.23, jl. bangka raya no.8, rt.2/rw.12, pela mampang, kota jakarta selatan",ChIJ6QThX33xaS4RyXnW6W5LXYY,0.020716399999989754
warteg 12,0,0,-6.2456501,106.8154862,"gg. amal iv no.2, rt.1/rw.11, pela mampang, kota jakarta selatan",ChIJKZzQV2LxaS4RN0Z4QmRSX78,0.014670199999989642
warteg putra bahari,4.7,6,-6.254445599999999,106.7951869,"jl. petogogan ii no.30a, rt.9/rw.5, pulo, kota jakarta selatan",ChIJe2cWC9bxaS4RVkwIlFDegZI,0.01602139999999963
warteg kharisma bahari - kostrad,4.5,19,-6.2533197,106.7852406,"jl. darma putra raya jl. swadaya no.51, rt.9/rw.5, kby. lama sel., kota jakarta selatan",ChIJ78_ZKA_xaS4RjhU79awBWnI,0.024841800000010572
warteg bangka 2,4.4,113,-6.2438636,106.819218,"jl. bangka ii no.rt.12, rt.12/rw.1, pela mampang, kota jakarta selatan",ChIJyzDruNjzaS4RBaMrsK3v6lU,0.018591700000000877
warteg raji,4.6,5,-6.246399299999999,106.7845764,"jl. duku raya no.12, rt.9/rw.9, kby. lama utara, kota jakarta selatan",ChIJYSz1fBfxaS4Rc5smXxQqVBo,0.01858559999999887
warteg munawar,4.5,17,-6.2598405,106.7852074,"jl. dwijaya iv, rt.7/rw.11, kby. lama sel., kota jakarta selatan",ChIJ48rKg6fxaS4RdVX2uuxZPIQ,0.031395800000001195
warteg kharisma bahari 24,4.6,57,-6.260949399999999,106.796151,"jl. hidup baru, rt.9/rw.6, gandaria utara, kota jakarta selatan",ChIJuQHgkZ_xaS4RhJK7eLjYLoE,0.021561100000010214
warteg prapanca,4.1,30,-6.256294,106.8048685,"jl. prapanca raya no.91, rt.9/rw.8, cipete utara, kota jakarta selatan",ChIJBbc-nXfxaS4RVBK2JIHWvPQ,0.01469639999999206
warteg kowantara jaksel,5,1,-6.241513299999999,106.8177321,"jl. bangka raya no.1, rt.2/rw.5, pela mampang, kota jakarta selatan",ChIJz4Xl2GHxaS4RmiyEQ3wPx7U,0.019456099999995757
wahyoo warteg kharisma bahari,5,1,-6.2602689,106.8011275,"jl. damai iv no.5, rt.1/rw.2, cipete utara, kota jakarta selatan",ChIJrwCBZ73xaS4RQeOSCrJbuHM,0.015904099999998422
warteg slawiayu,5,1,-6.236124299999999,106.8157183,"blok s, jl. senayan, rt.5/rw.6, rw. bar., kota jakarta selatan",ChIJxxTspF_xaS4RSg0lD1RiMWA,0.022831299999995558
warteg bmw / warteg bude,5,1,-6.2604264,106.8010327,"jalan damai iv no.4 rt.004/rw.05, rt.4/rw.2, cipete utara, kota jakarta selatan",ChIJMaAOw53xaS4RW4U7eBhxMd0,0.016156400000012283
warteg berkah mak rawi,4.5,4,-6.2557886,106.799985,"jl. darmawangsa ii no.27, rt.7/rw.1, pulo, kota jakarta selatan",ChIJd45hDDLxaS4RpxzkcBGMgDs,0.012566299999998698
warteg kirana bahari,4.5,24,-6.234984,106.818697,"jl. poncol jaya no.20, rt.9/rw.4, kuningan bar., kota jakarta selatan",ChIJt0NuzuHzaS4Rq7gif9mfGWs,0.026950299999994876
warteg dewi,5,3,-6.262671399999999,106.7855896,"jl. margaguna raya a no.9, rt.4/rw.15, gandaria utara, kota jakarta selatan",ChIJxyiN96bxaS4R-q2adJP7T-8,0.0338445000000096
warteg barokah,0,0,-6.233607699999999,106.789618,"jl. martimbang raya no.5, rt.3/rw.5, gunung, kota jakarta selatan",ChIJYWy1SjnxaS4RLPO6FN5SrsU,0.023240400000001493
warteg rezkq,5,2,-6.258972,106.7896343,"jl. h. zainuddin no.27-7, rt.5/rw.14, gandaria utara, kota jakarta selatan",ChIJE_-oVybxaS4R2kNkeOhgJiU,0.026100400000002466
warteg citra jaya bahari 24 jam,4.9,7,-6.259878,106.795719,"jl. gotong royong, rt.4/rw.6, gandaria utara, kota jakarta selatan",ChIJj3GRO8DxaS4RJW_37-8rV88,0.02092169999999971
warteg kharisma bahari - senopati,4.9,13,-6.2297926,106.8076864,"jl. tulodong atas no.1 no.3, rt.6/rw.3, senayan, kota jakarta selatan",ChIJfTBswT_xaS4RbXxLGbiUOnI,0.02113109999998919
wahyoo warteg mekarsari,4.5,79,-6.2522474,106.7833053,"dalam k nomor, jl. praja no.40, rt.7/rw.5, kby. lama sel., kota jakarta selatan",ChIJNS1Wdg_xaS4RQUMIMTYVufw,0.025704800000010408
wahyoo warteg berkah bahari,5,1,-6.2532236,106.7842465,"jl. praja no.dalam, rt.5/rw.5, south kebayoran lama, south jakarta city",ChIJydRgLtzxaS4RhDc26tp6fU0,0.02573980000001086
warteg mulya bahari,4.3,301,-6.2637941,106.7908567,"jl. h. nawi raya no.73, rt.6, gandaria utara, kota jakarta selatan",ChIJVZgWeqHxaS4RaoBtJDqp_zY,0.029700099999999452
